{
  "command_id": "7a6b5c4d-0000-4000-8000-000000000201",
  "hub_id": "pi-hub-01",
  "type": "scan_network",
  "payload": {
    "subnet": "192.168.50.0/24",
    "mode": "host_discovery"
  },
  "created_at": "2026-04-22T14:45:00Z",
  "dispatched_at": null,
  "completed_at": null,
  "expires_at": "2026-04-22T14:50:00Z",
  "status": "pending",
  "result": null,
  "error": null,
  "schema_version": "v1"
}
